{
  "watcher_id": "example-secret-scan",
  "name": "Example Secret Scan Watcher",
  "version": "0.1.0",
  "producer": {
    "identity": "example-secret-scan",
    "maintainer": "veridict-examples"
  },
  "capabilities": {
    "evidence_classes": [
      "STATIC_ANALYSIS"
    ],
    "max_tier": "W1b",
    "subscribes_to": [
      "secret",
      "security",
      "credentials"
    ]
  },
  "resource_class": {
    "timeout_seconds": 60,
    "cost_budget": 0.0,
    "sandbox_level": "inprocess"
  },
  "integrity": {
    "code_hash": "2439fdb268bbcfe16595791f1ededc8c59de6cdfb821afebc2a3d8166e6db517",
    "update_policy": "manual"
  }
}